{
  "$schema": "../../../schemas/request-template.schema.json",
  "captureMode": "http",
  "method": "POST",
  "path": "/v2/bookings",
  "headers": {
    "Authorization": "Bearer ${CALDIY_API_KEY}",
    "cal-api-version": "2024-08-13"
  },
  "body": {
    "eventTypeId": 1001,
    "start": "2026-05-01T16:00:00.000Z",
    "attendee": {
      "name": "Unavailable Slot Fixture",
      "email": "unavailable-slot@example.test",
      "timeZone": "America/Chicago"
    },
    "idempotencyKey": "fixture-booking-unavailable-slot"
  },
  "expectStatus": [400]
}
