{
  "$schema": "../../../schemas/request-template.schema.json",
  "captureMode": "http",
  "method": "POST",
  "path": "/v2/bookings",
  "headers": {
    "Authorization": "Bearer ${CALDIY_API_KEY}",
    "cal-api-version": "2024-08-13"
  },
  "body": {
    "eventTypeId": 1001,
    "start": "2026-05-01T15:00:00.000Z",
    "metadata": {
      "clientSecret": "super-secret-fixture"
    }
  },
  "expectStatus": [400]
}
