{
  "$schema": "../../../schemas/request-template.schema.json",
  "captureMode": "http",
  "method": "POST",
  "path": "/v2/bookings/{bookingUid}/cancel",
  "pathParams": {
    "bookingUid": "mock-booking-personal-basic"
  },
  "headers": {
    "Authorization": "Bearer ${CALDIY_API_KEY}",
    "cal-api-version": "2024-08-13"
  },
  "body": {
    "cancellationReason": "Fixture cancellation"
  },
  "expectStatus": [200]
}
