{
  "$schema": "../../../schemas/request-template.schema.json",
  "captureMode": "http",
  "method": "POST",
  "path": "/v2/bookings",
  "headers": {
    "Authorization": "Bearer cal_test_unauthorized_mock",
    "cal-api-version": "2024-08-13"
  },
  "body": {
    "eventTypeId": 1001,
    "start": "2026-05-03T15:00:00.000Z",
    "attendee": {
      "name": "Unauthorized Fixture",
      "email": "unauthorized-fixture@example.test",
      "timeZone": "America/Chicago"
    }
  },
  "expectStatus": [401, 403]
}
