{
  "$schema": "../../../schemas/request-template.schema.json",
  "captureMode": "http",
  "method": "POST",
  "path": "/v2/bookings/{bookingUid}/confirm",
  "pathParams": {
    "bookingUid": "mock-booking-pending-confirm"
  },
  "headers": {
    "Authorization": "Bearer ${CALDIY_API_KEY}",
    "cal-api-version": "2024-08-13"
  },
  "body": {},
  "expectStatus": [200]
}
