{
  "$schema": "../../../schemas/request-template.schema.json",
  "captureMode": "http",
  "method": "POST",
  "path": "/v2/bookings",
  "headers": {
    "Authorization": "Bearer ${CALDIY_API_KEY}",
    "cal-api-version": "2024-08-13"
  },
  "body": {
    "eventTypeId": 1001,
    "start": "2026-05-01T15:00:00.000Z",
    "attendee": {
      "name": "Fixture Attendee",
      "email": "fixture-attendee@example.test",
      "timeZone": "America/Chicago"
    },
    "responses": {
      "name": "Fixture Attendee",
      "email": "fixture-attendee@example.test"
    },
    "metadata": {
      "fixture": "duplicate-idempotency-key"
    },
    "idempotencyKey": "fixture-booking-personal-basic"
  },
  "expectStatus": [200, 201, 409]
}
