{
  "$schema": "../../../schemas/request-template.schema.json",
  "captureMode": "http",
  "method": "POST",
  "path": "/v2/bookings/{bookingUid}/reschedule",
  "pathParams": {
    "bookingUid": "mock-booking-personal-basic"
  },
  "headers": {
    "Authorization": "Bearer ${CALDIY_API_KEY}",
    "cal-api-version": "2024-08-13"
  },
  "body": {
    "start": "2026-05-02T15:00:00.000Z",
    "reschedulingReason": "Fixture reschedule"
  },
  "expectStatus": [200, 201]
}
