{
  "$schema": "../../../schemas/request-template.schema.json",
  "captureMode": "http",
  "method": "GET",
  "path": "/v2/bookings/{bookingUid}",
  "pathParams": {
    "bookingUid": "mock-booking-personal-basic"
  },
  "headers": {
    "Authorization": "Bearer ${CALDIY_API_KEY}",
    "cal-api-version": "2024-08-13"
  },
  "expectStatus": [200]
}
