{
  "$schema": "../../../schemas/request-template.schema.json",
  "captureMode": "http",
  "method": "GET",
  "path": "/v2/oauth-clients/{clientId}",
  "pathParams": {
    "clientId": "${CALDIY_PLATFORM_CLIENT_ID}"
  },
  "headers": {
    "x-cal-client-id": "${CALDIY_PLATFORM_CLIENT_ID}",
    "x-cal-secret-key": "${CALDIY_PLATFORM_CLIENT_SECRET}",
    "cal-api-version": "2024-08-13"
  },
  "expectStatus": [200]
}
